{
  "schema_version": "1.0",
  "phase": "planning",
  "project": {
    "title": "新项目",
    "project_type": "architecture",
    "stage": null,
    "languages": [
      "zh"
    ],
    "continuous_decimals": 2
  },
  "sources": [],
  "schemes": [],
  "facts": [],
  "figures": [],
  "pages": [],
  "deliverables": [],
  "checks": []
}
